Quais são os sabores de pizza?	Calabresa, 4 Queijos, Lombinho, Frango com Catupiry
Quais são os tipos de borda?	Sem borda, borda com catupiry
Quais são os tamanhos de pizza?	Brotinho, Médio(6 pedaços) e Grande(8 pedaços)
Posso pedir meio a meio?	Sim, mas está disponível apenas para tamanhos Médio e Grande.
Quais são os valores?	Brotinho qualquer sabor: R$ 10,00; Médio qualquer sabor: R$ 12,00; Grande qualquer sabor: R$ 15,00
Tem refrigerante?	Temos Coca-cola, Guaraná Antártica e Soda Skin, em lata R$ 3,00 e 2L R$ 5,00
Entrega em domícilio?	Sim, para Paulínia - SP e Campinas - SP
Qual a taxa de entrega?	Entrega grátis para Paulínia - SP, para Campinas - SP R$ 5,00